{
 "schema_version": "1.0",
 "contract_version": "1.1.0",
 "generated_at": "2026-10-23",
 "source": {
  "matches": 28,
  "shots": 67813,
  "hits_used_for_scale": 4811
 },
 "recoil": {
  "conventions": [
   "pitch e yaw do punch em graus; pitch negativo = a mira sobe (padrão do jogo)",
   "'bullet' é a posição da bala na rajada: 1 = primeira depois de soltar o gatilho (igual ao spray_index do log)",
   "o punch é o valor do jogo (m_predictableBaseAngle) lido no instante do tiro, acumulado desde o início da rajada",
   "direção real da bala = ângulo da mira do jogador + scale.value * punch + dispersão (spread + inaccuracy)",
   "só rajadas contínuas (intervalo entre tiros até 1,3x o tempo de ciclo) entram nas tabelas",
   "depois de uma pausa maior que ~1,3 ciclo a rajada reinicia na bala 1 (ver reset.restart_by_pause)",
   "patterns[].penalty é o m_fAccuracyPenalty do jogo no instante do tiro: a parte do cone de dispersão que cresce com a rajada"
  ],
  "reset_rule": {
   "pause_over_cycle_max": 1.3,
   "meaning": "se a pausa desde o último tiro passar de pause_over_cycle_max x cycle_time_s, o próximo tiro é a bala 1"
  },
  "scale": {
   "value": 2.0,
   "fitted": 2.047,
   "ci95": [
    1.985,
    2.118
   ],
   "n_hits": 4811,
   "method": "regressão de (erro vertical da mira em relação à cabeça) sobre (punch para cima), tiros que acertaram a até 30 m, bala >= 3",
   "note": "O valor 2.0 é o weapon_recoil_scale padrão do CS; o ajuste fica dentro do intervalo de confiança."
  },
  "patterns": {
   "ak47": {
    "cycle_time_s": 0.1,
    "max_measured_bullet": 27,
    "bullets": [
     {
      "bullet": 1,
      "n": 1653,
      "pitch": 0.0,
      "yaw": 0.0,
      "pitch_sd": 0.317,
      "yaw_sd": 0.083,
      "penalty": 0.01348
     },
     {
      "bullet": 2,
      "n": 3768,
      "pitch": -0.0979,
      "yaw": -0.0506,
      "pitch_sd": 0.212,
      "yaw_sd": 0.045,
      "penalty": 0.01742
     },
     {
      "bullet": 3,
      "n": 3206,
      "pitch": -0.6234,
      "yaw": 0.0007,
      "pitch_sd": 0.256,
      "yaw_sd": 0.034,
      "penalty": 0.01954
     },
     {
      "bullet": 4,
      "n": 2741,
      "pitch": -1.4381,
      "yaw": -0.0729,
      "pitch_sd": 0.243,
      "yaw_sd": 0.056,
      "penalty": 0.02095
     },
     {
      "bullet": 5,
      "n": 2215,
      "pitch": -2.3046,
      "yaw": -0.0965,
      "pitch_sd": 0.224,
      "yaw_sd": 0.111,
      "penalty": 0.02233
     },
     {
      "bullet": 6,
      "n": 1736,
      "pitch": -3.0992,
      "yaw": 0.2425,
      "pitch_sd": 0.199,
      "yaw_sd": 0.097,
      "penalty": 0.02313
     },
     {
      "bullet": 7,
      "n": 1290,
      "pitch": -3.8177,
      "yaw": 0.4476,
      "pitch_sd": 0.156,
      "yaw_sd": 0.135,
      "penalty": 0.02362
     },
     {
      "bullet": 8,
      "n": 943,
      "pitch": -4.3417,
      "yaw": 0.8039,
      "pitch_sd": 0.127,
      "yaw_sd": 0.231,
      "penalty": 0.02396
     },
     {
      "bullet": 9,
      "n": 675,
      "pitch": -4.744,
      "yaw": 0.3567,
      "pitch_sd": 0.108,
      "yaw_sd": 0.284,
      "penalty": 0.0244
     },
     {
      "bullet": 10,
      "n": 491,
      "pitch": -4.6035,
      "yaw": -0.807,
      "pitch_sd": 0.212,
      "yaw_sd": 0.175,
      "penalty": 0.02423
     },
     {
      "bullet": 11,
      "n": 393,
      "pitch": -4.7303,
      "yaw": -1.356,
      "pitch_sd": 0.222,
      "yaw_sd": 0.173,
      "penalty": 0.02451
     },
     {
      "bullet": 12,
      "n": 315,
      "pitch": -4.9985,
      "yaw": -0.9845,
      "pitch_sd": 0.207,
      "yaw_sd": 0.176,
      "penalty": 0.02417
     },
     {
      "bullet": 13,
      "n": 242,
      "pitch": -5.0285,
      "yaw": -1.4114,
      "pitch_sd": 0.183,
      "yaw_sd": 0.198,
      "penalty": 0.02376
     },
     {
      "bullet": 14,
      "n": 193,
      "pitch": -4.8482,
      "yaw": -2.0895,
      "pitch_sd": 0.138,
      "yaw_sd": 0.262,
      "penalty": 0.0226
     },
     {
      "bullet": 15,
      "n": 157,
      "pitch": -4.9691,
      "yaw": -2.166,
      "pitch_sd": 0.054,
      "yaw_sd": 0.386,
      "penalty": 0.02254
     },
     {
      "bullet": 16,
      "n": 139,
      "pitch": -5.071,
      "yaw": -1.1256,
      "pitch_sd": 0.06,
      "yaw_sd": 0.282,
      "penalty": 0.02285
     },
     {
      "bullet": 17,
      "n": 112,
      "pitch": -5.2399,
      "yaw": -0.5839,
      "pitch_sd": 0.037,
      "yaw_sd": 0.183,
      "penalty": 0.02228
     },
     {
      "bullet": 18,
      "n": 93,
      "pitch": -5.3994,
      "yaw": -0.2029,
      "pitch_sd": 0.016,
      "yaw_sd": 0.197,
      "penalty": 0.02217
     },
     {
      "bullet": 19,
      "n": 78,
      "pitch": -5.4029,
      "yaw": 0.4896,
      "pitch_sd": 0.061,
      "yaw_sd": 0.227,
      "penalty": 0.02217
     },
     {
      "bullet": 20,
      "n": 65,
      "pitch": -5.1545,
      "yaw": 1.4034,
      "pitch_sd": 0.046,
      "yaw_sd": 0.159,
      "penalty": 0.02217
     },
     {
      "bullet": 21,
      "n": 53,
      "pitch": -5.18,
      "yaw": 0.8261,
      "pitch_sd": 0.036,
      "yaw_sd": 0.045,
      "penalty": 0.02286
     },
     {
      "bullet": 22,
      "n": 45,
      "pitch": -5.2413,
      "yaw": 0.976,
      "pitch_sd": 0.045,
      "yaw_sd": 0.058,
      "penalty": 0.0223
     },
     {
      "bullet": 23,
      "n": 39,
      "pitch": -5.3883,
      "yaw": 0.7676,
      "pitch_sd": 0.037,
      "yaw_sd": 0.05,
      "penalty": 0.02217
     },
     {
      "bullet": 24,
      "n": 32,
      "pitch": -5.5228,
      "yaw": 0.5527,
      "pitch_sd": 0.027,
      "yaw_sd": 0.195,
      "penalty": 0.02333
     },
     {
      "bullet": 25,
      "n": 27,
      "pitch": -5.4299,
      "yaw": 1.0788,
      "pitch_sd": 0.084,
      "yaw_sd": 0.479,
      "penalty": 0.02286
     },
     {
      "bullet": 26,
      "n": 21,
      "pitch": -5.4707,
      "yaw": 1.2219,
      "pitch_sd": 0.0,
      "yaw_sd": 0.0,
      "penalty": 0.02286
     },
     {
      "bullet": 27,
      "n": 18,
      "pitch": -5.5294,
      "yaw": 0.6677,
      "pitch_sd": 0.0,
      "yaw_sd": 0.0,
      "penalty": 0.02315
     }
    ]
   },
   "famas": {
    "cycle_time_s": 0.09,
    "max_measured_bullet": 11,
    "bullets": [
     {
      "bullet": 1,
      "n": 67,
      "pitch": 0.0,
      "yaw": 0.0,
      "pitch_sd": 0.16,
      "yaw_sd": 0.044,
      "penalty": 0.01283
     },
     {
      "bullet": 2,
      "n": 169,
      "pitch": -0.0561,
      "yaw": -0.0507,
      "pitch_sd": 0.105,
      "yaw_sd": 0.035,
      "penalty": 0.01504
     },
     {
      "bullet": 3,
      "n": 110,
      "pitch": -0.111,
      "yaw": -0.039,
      "pitch_sd": 0.121,
      "yaw_sd": 0.042,
      "penalty": 0.01643
     },
     {
      "bullet": 4,
      "n": 88,
      "pitch": -0.4385,
      "yaw": -0.2235,
      "pitch_sd": 0.168,
      "yaw_sd": 0.018,
      "penalty": 0.01786
     },
     {
      "bullet": 5,
      "n": 78,
      "pitch": -0.9384,
      "yaw": -0.2747,
      "pitch_sd": 0.143,
      "yaw_sd": 0.056,
      "penalty": 0.01943
     },
     {
      "bullet": 6,
      "n": 64,
      "pitch": -1.5218,
      "yaw": -0.2652,
      "pitch_sd": 0.114,
      "yaw_sd": 0.139,
      "penalty": 0.02052
     },
     {
      "bullet": 7,
      "n": 44,
      "pitch": -1.9284,
      "yaw": 0.1135,
      "pitch_sd": 0.076,
      "yaw_sd": 0.116,
      "penalty": 0.02087
     },
     {
      "bullet": 8,
      "n": 38,
      "pitch": -2.2418,
      "yaw": 0.5369,
      "pitch_sd": 0.081,
      "yaw_sd": 0.032,
      "penalty": 0.02118
     },
     {
      "bullet": 9,
      "n": 31,
      "pitch": -2.5989,
      "yaw": 0.3705,
      "pitch_sd": 0.036,
      "yaw_sd": 0.133,
      "penalty": 0.02173
     },
     {
      "bullet": 10,
      "n": 28,
      "pitch": -2.745,
      "yaw": -0.177,
      "pitch_sd": 0.029,
      "yaw_sd": 0.105,
      "penalty": 0.02184
     },
     {
      "bullet": 11,
      "n": 20,
      "pitch": -2.8555,
      "yaw": -0.5896,
      "pitch_sd": 0.016,
      "yaw_sd": 0.076,
      "penalty": 0.02191
     }
    ]
   },
   "galilar": {
    "cycle_time_s": 0.09,
    "max_measured_bullet": 20,
    "bullets": [
     {
      "bullet": 1,
      "n": 410,
      "pitch": 0.0,
      "yaw": 0.0,
      "pitch_sd": 0.265,
      "yaw_sd": 0.083,
      "penalty": 0.01498
     },
     {
      "bullet": 2,
      "n": 879,
      "pitch": -0.0607,
      "yaw": 0.0561,
      "pitch_sd": 0.138,
      "yaw_sd": 0.048,
      "penalty": 0.018
     },
     {
      "bullet": 3,
      "n": 685,
      "pitch": -0.1173,
      "yaw": 0.0235,
      "pitch_sd": 0.199,
      "yaw_sd": 0.085,
      "penalty": 0.01973
     },
     {
      "bullet": 4,
      "n": 591,
      "pitch": -0.4602,
      "yaw": 0.1881,
      "pitch_sd": 0.217,
      "yaw_sd": 0.082,
      "penalty": 0.02149
     },
     {
      "bullet": 5,
      "n": 496,
      "pitch": -0.8964,
      "yaw": 0.5286,
      "pitch_sd": 0.232,
      "yaw_sd": 0.037,
      "penalty": 0.0231
     },
     {
      "bullet": 6,
      "n": 395,
      "pitch": -1.4799,
      "yaw": 0.5189,
      "pitch_sd": 0.202,
      "yaw_sd": 0.036,
      "penalty": 0.02456
     },
     {
      "bullet": 7,
      "n": 305,
      "pitch": -2.0711,
      "yaw": 0.5444,
      "pitch_sd": 0.152,
      "yaw_sd": 0.08,
      "penalty": 0.02526
     },
     {
      "bullet": 8,
      "n": 232,
      "pitch": -2.533,
      "yaw": 0.719,
      "pitch_sd": 0.105,
      "yaw_sd": 0.103,
      "penalty": 0.0259
     },
     {
      "bullet": 9,
      "n": 171,
      "pitch": -2.8077,
      "yaw": 1.0143,
      "pitch_sd": 0.089,
      "yaw_sd": 0.218,
      "penalty": 0.02639
     },
     {
      "bullet": 10,
      "n": 121,
      "pitch": -3.127,
      "yaw": 0.8736,
      "pitch_sd": 0.028,
      "yaw_sd": 0.317,
      "penalty": 0.02674
     },
     {
      "bullet": 11,
      "n": 94,
      "pitch": -3.2983,
      "yaw": 0.2843,
      "pitch_sd": 0.094,
      "yaw_sd": 0.37,